{
    "id": "46ed8885-6e93-4d2c-a704-e3f97421cd15",
    "app_id": "62dfb91a0007ff0000000001",
    "user_id": "698ca587b2a1122576abf9af",
    "class": "bullying",
    "confidence_score": 0.8233574067287723,
    "images": {
        "6be4aaa886d9ad78303ab997fbefcc097b60406e/raw": {
            "class": "bullying",
            "confidence_score": 0.4120648708214496
        },
        "aekoriginale4aaa886d9ad78303ab997fbefcc097b60506e/raw": {
            "class": "no-bullying",
            "confidence_score": 0.6473046879615659
        }
    }
}
